{
  "$schema": "https://json-schema.org/draft/2020-12/schema",
  "$id": "urn:vega:schema:page-template:1",
  "title": "vega/page-template@1 — vega-show/assets/page/TEMPLATE.json, the page template's identity",
  "description": "Generated by page_template.write_manifest() (W07; first generated by W15, regenerated by every WP that changes the template afterwards) and never edited by hand. files lists every file under assets/page/ except TEMPLATE.json itself, package.json and tests/, with its digest; build_showcase.py copies exactly those files byte for byte into <bundle>/showcase/page/ and verify_template_copy(page_dir) returns [] only when the copy holds exactly them. requires_endpoints (moved here from D5's page-manifest.json) must be a subset of MANIFEST.serve.endpoints (gate PF5). strings_keys_digest is the digest of strings.keys.json, the generated key list the vega-show sync test reads.",
  "type": "object",
  "additionalProperties": false,
  "required": ["schema", "version", "files", "requires_endpoints", "strings_keys_digest"],
  "properties": {
    "schema": { "const": "vega/page-template@1" },
    "version": { "type": "string", "pattern": "^\\d+\\.\\d+\\.\\d+$" },
    "files": {
      "type": "object", "minProperties": 1,
      "required": ["index.html"],
      "propertyNames": {
        "type": "string",
        "pattern": "^(?!/)(?!.*(^|/)\\.\\.(/|$))[A-Za-z0-9._/-]{1,200}\\.(html|css|js|json|svg|woff2)$",
        "not": { "anyOf": [ { "const": "TEMPLATE.json" }, { "const": "package.json" }, { "pattern": "^tests/" } ] }
      },
      "additionalProperties": { "type": "string", "pattern": "^sha256:[0-9a-f]{64}$" }
    },
    "requires_endpoints": {
      "type": "array", "uniqueItems": true, "minItems": 1,
      "items": { "type": "string", "pattern": "^(GET|POST|PUT|DELETE|PATCH|HEAD) /\\S*$" }
    },
    "strings_keys_digest": { "type": "string", "pattern": "^sha256:[0-9a-f]{64}$" }
  },
  "examples": [
    {
      "schema": "vega/page-template@1",
      "version": "2.3.0",
      "files": { "index.html": "sha256:0000000000000000000000000000000000000000000000000000000000000001",
                 "page.css": "sha256:0000000000000000000000000000000000000000000000000000000000000002",
                 "strings.keys.json": "sha256:0000000000000000000000000000000000000000000000000000000000000003",
                 "js/main.js": "sha256:0000000000000000000000000000000000000000000000000000000000000004",
                 "js/core/strings.en.js": "sha256:0000000000000000000000000000000000000000000000000000000000000005",
                 "css/network.css": "sha256:0000000000000000000000000000000000000000000000000000000000000006" },
      "requires_endpoints": ["GET /health", "GET /v1/schema", "GET /v1/examples", "GET /v1/network", "POST /v1/explain",
                             "GET /v1/code", "POST /v1/predict", "POST /v1/predict/csv"],
      "strings_keys_digest": "sha256:0000000000000000000000000000000000000000000000000000000000000003"
    }
  ]
}
