{
 "schema": "vega/page-template@1",
 "version": "2.3.0",
 "files": {
  "css/code.css": "sha256:86ab44fc916eb616865b33c9b5c15fe838bf7122643b0858acd047205794d7b0",
  "css/graph.css": "sha256:a937c94604529a054669cdb4c9eca8fe474da38183adf38214d112515da997bc",
  "css/latent.css": "sha256:ebba4fc0a39791479124208473547f2d13cecd154e7ca697e7f699b7bd2657a4",
  "css/network.css": "sha256:19641156681aad94df12576b3ad260f463f92e3ab36a01167d72e735c0f45a86",
  "css/sequence.css": "sha256:15e8abfab53dfc0ab6b1f0743c3c869dbfdb0a10015e1055acc939c51f5196f4",
  "css/stepper.css": "sha256:4233ff1f7025eb7d2b59b08ac602211fc5aa318c20922c571f8d8c7625e1e159",
  "css/views.css": "sha256:3b45a107feda3d52a20149432141cf6a51cf9bde34631057b9f5fccf306f7dc9",
  "index.html": "sha256:313c2b55a7aa98d5617153e3a6c858b34d21fb3c23f5e174f8be016faf2e427f",
  "js/core/api.js": "sha256:e639989509cfc7bf613bd0fc8a0f9b0031af43597f5581ab7f2ffda673afad61",
  "js/core/bars.js": "sha256:b63fb089ad3ac72e5d5019277924d74f89a86d84c531a7c1138d533ef33fdc25",
  "js/core/decode.js": "sha256:014ad2ac608fb5a4ce60479f14d2d22b3b2eb569b5e3752b4a352f2e62ac04bf",
  "js/core/disclose.js": "sha256:bf74a3222d3243245f01555f9b98a7b016a62258b531ba6a75c148b7f56827c0",
  "js/core/dom.js": "sha256:4d72dd345bf8ab9ac5053216c6b407cb803b6469d0f5ab9e67af25eebe6140df",
  "js/core/fmt.js": "sha256:f86d2ad2d575b94c488bc1d7363b19a3239772936eca8f4f65e28c6eefcbcf9a",
  "js/core/lane.js": "sha256:f44e82b0091dd4c475fdd0c821b1f126ea1de61aecb2067200c76149e7b8f673",
  "js/core/lexicon.js": "sha256:2ee16f0323f0b6717ec5039bbdeee695d609b294cd88b454c4707364bec4d4b4",
  "js/core/node-names.js": "sha256:8c58cefe3fa755dcaa4bdf968250b13aed1e421fdb6d4efcc9654dc90e93222d",
  "js/core/probe-walk.js": "sha256:9d1a9fc25a5ad60518cf069abb035b8cb33399d8ab157684a4e7eb6b980019db",
  "js/core/probe.js": "sha256:16cbad343ca0a1845f3f99410efa8c8be97484ad8c14d7ea31430d1c9eae6413",
  "js/core/roles.js": "sha256:e843bbf74c420b9bc8e484b850f931024c6dfce46af3c93bd5630744df976bc3",
  "js/core/state.js": "sha256:90038e32cf193c8b3e3d175e4e1e20ac4e7efa05325adfab2055c2d49d1d1092",
  "js/core/strings/code.en.js": "sha256:9f82629642c19122ca95e35970c47b15fa6c6a9c7d9db6103ec7474de06d12fa",
  "js/core/strings/core.en.js": "sha256:d288a040c9d05fa76faba693044cb3daa4b068fbdaa53f236d0ace12bea4caf2",
  "js/core/strings/graph.en.js": "sha256:32ede84408353a7a377c1655290792c4a221ab889958f1f1a93cb38338d10e09",
  "js/core/strings/how-advanced.en.js": "sha256:bced20fcb4f50fadf7544d321a85edfeab5f2229dbf7c55938fb5c9e69bcc996",
  "js/core/strings/latent.en.js": "sha256:6f0a8b662fa77ba94701b6099a742b4c4427ca2fd738c10b3a55ad7b06171013",
  "js/core/strings/network.en.js": "sha256:c17f80721a4d3e4a234a02fcbd1d63973c187a9f162beb7296e43a9c3bb106d3",
  "js/core/strings/sequence.en.js": "sha256:095d89f15f19ee7dafefd8a22e9604b4c5e9b4c382962dfa5ec087ff79e84e82",
  "js/core/strings/stepper.en.js": "sha256:ba6b6bae4ad3119ad6f86b315b42b525c248d17f6a161f197710bc1488df58d5",
  "js/core/strings/views.en.js": "sha256:988b150055048b30f2442a4041281eb4a64cea7dd52f71227e5f16395563790c",
  "js/core/strings.en.js": "sha256:7ec5dc1ad302be362463b9e5de37c911e88721d2e5e071978c85818347e9dc7d",
  "js/core/strings.keys.js": "sha256:dfc3972f2d18dc8606a8e95df8e01b8c95a577d52038761172b0f2467eaac47c",
  "js/core/text.js": "sha256:7c44b8ccd8ea49331006b449fbe27d8908ccebdf728c3407ff88941cb0e71689",
  "js/core/theme.js": "sha256:49a048d067b3e910b18b2b436d747dbd5e5f9c7b6ee453e8ab3a5fffa62460d8",
  "js/core/tour.js": "sha256:dc98f65277f3ca34f5dae19d0101407fd6888a67c8f3cb85dd92b2de342e9138",
  "js/how/act.js": "sha256:30487d0d8c4cd4affe2f07eb0564eb72bf7b4ebc0d799f960d4a8e31cbb7c5f6",
  "js/how/answer.js": "sha256:4e222be58afc89c4debf7dc4b77a53435ffa2bf67bd081adda211649c0449e68",
  "js/how/cells.js": "sha256:6700a1827574ec8a708ee531c65729698e3f1b5ae0a1c3dee172181142c6fe69",
  "js/how/explainers/attention.js": "sha256:20e9af0cf9ba768fc901a6059a2d06c9f4c4f9f040ad2b4f7a9253bc72085c29",
  "js/how/explainers/conv.js": "sha256:0335df9b90e78ff7acbdadf8b11ba8c54a1b01b8698fcf0bc9e4c2038c3f350b",
  "js/how/explainers/dense.js": "sha256:cd48c15af31c666a985c21a3b7cf7403c9dc14a9321dae97842e4cb439abbb47",
  "js/how/explainers/embedding.js": "sha256:35512640805f4123abbb8bc6e7faddb319f66ee75307f5dc33e3be06baa0d1c8",
  "js/how/explainers/generic.js": "sha256:dcb89813420f4a5fa9865d1b100f04bd927c1af53d9b904caad51c4d0ab2b403",
  "js/how/explainers/graph.js": "sha256:ea629a71da737c2e36d77cf2a3258ae31682fa45bec740f670ffd952db12f9ef",
  "js/how/explainers/index.js": "sha256:d3615bf3fda33e73cbebe39e515d9e66d9bd93a8a3a5aeb624db69b35cb04de5",
  "js/how/explainers/input.js": "sha256:55e41ccbe5fe71ad413eb982794be8a8ac3158b7582c6bccf0338305d7b43cea",
  "js/how/explainers/latent.js": "sha256:2b39cd60cd78ba48bb38215838cf50c5e9665920c222aa59a33a4255c43de46d",
  "js/how/explainers/link.js": "sha256:a0bfb4b6f5bb42669af69a3d309172ce2906d4c36685f1a7ddb0e817fd288ec2",
  "js/how/explainers/norm.js": "sha256:4883494026ecdebf6843bc60d18b44aed8357c0846ff924c08ab9a25dd2246fe",
  "js/how/explainers/pool.js": "sha256:59efcbe287139ca5a335a3f73800d2623dbc90cdb72242a632bd173baf28b636",
  "js/how/explainers/recurrent.js": "sha256:6b0b2e7e81c69bdd98a8f74e81a9f61360432a325e4c7f4f3f46766b8a828930",
  "js/how/explainers/residual.js": "sha256:2df5017d899911b26fc27a18aee2997824d151117c03fb56663db5a3f63fe10a",
  "js/how/stepper.js": "sha256:d6f37216115c6fac01dc4bca38438d90caf0e3e8dbd9a56e30179cd520001021",
  "js/how/sum.js": "sha256:29ebc85a8f4eeb82a1ab446fbe100a25b9ce1ec253e5b20d617b1d2f297b71b5",
  "js/main.js": "sha256:9c64bd308c05aeaaf6dea15841a911af65918e72b784f92bbc64284556167006",
  "js/motif/field.js": "sha256:ee7ee9a1b58d309750eded2d738d9af48bef1d1a3d2288b2cf3d5f66dfc29e99",
  "js/motif/motifs.js": "sha256:0dc03c02dec07634db714281dc80d261cc057501bc2cdb3ddbd84ad5735224a2",
  "js/net/canvas.js": "sha256:f7e2160302e82864e08b230c1b28a267d0d29a9dde78edc8d2c54408ea3797ea",
  "js/net/card.js": "sha256:36b5b9bdb8f35e7b274581289e2e72f31ef49fce111e38d939761aeb61e656eb",
  "js/net/families.js": "sha256:1c4d446709290a3530910c736229a14d552b5cdba4794c9c9e06acc73dedbf2b",
  "js/net/graph.js": "sha256:6ad6ace27dd54a0d8a2e2c495596e20c21b46a91c1ebd0c1bfd3d00bec87663b",
  "js/net/guide.js": "sha256:b250bc77337eed81be77ff6ec13c43fc1de0c6be60714cdc3135292e0b17a0b2",
  "js/net/kinds.js": "sha256:b242d8787d6118105f40ce88de462b875faa2dfcd03b2019bf8931b1b9539258",
  "js/net/relevance.js": "sha256:a52494a6d2d25e9018d6ed94e78edecac55b1794e63b88750dba7eb62988e56e",
  "js/net/renderers/attention.js": "sha256:b1f96a60613fa377fed14414996f4caf8690e289bd5dfa7ebcea0e78841e619a",
  "js/net/renderers/box.js": "sha256:2036293b940b72fd4050ffed760c58f3aef73658892042de1e5603251f8a1c8e",
  "js/net/renderers/conv.js": "sha256:421ccb17a81c4f0bbdba0fea5f6c10ac4a174e5c35bc5b0404776a7685d7c2b5",
  "js/net/renderers/dense-detail.js": "sha256:9bfe39272752f2bb0b5720d5d5073171d1773eb62aa37134c1bd45dc474862d8",
  "js/net/renderers/dense.js": "sha256:3ccc7c80a586d55e2eca7752d67bc205f1656b4a5a5fa33f710a75bab1ce818f",
  "js/net/renderers/graph.js": "sha256:35bcc6c4d7371a96e517e3c584f23c9560c16ebbb2836c800412000e9a8ccfed",
  "js/net/renderers/group.js": "sha256:8a2008c92340f4ad3bb5fd4eb3bbef36152640aa5f4627d39123991e7b0c210d",
  "js/net/renderers/head.js": "sha256:59c9fb0c6f795a7078f75965306b5267cb5d2cc4ff1dac0f40184efb379afbc7",
  "js/net/renderers/index.js": "sha256:f68f9d13f7694fe0c1349c641d8059aaf454583882b47ccb76b27df952cf5be2",
  "js/net/renderers/input.js": "sha256:7494a65deb5b640a3ea02cc5c443d9b367d2f72184e435ee028f07517eedddc0",
  "js/net/renderers/latent.js": "sha256:3ba20f300b03c26bc17258d38138a0b7e78a1d5959d60e2c7c227fceb065e0f8",
  "js/net/renderers/recurrent.js": "sha256:97d6d05771c04606c6231cfd51ca42b18061e19417e410ba0e1dfba290ee442c",
  "js/net/renderers/run-segment.js": "sha256:68e23e932e2a7638bf0224ec5972d9f26888a041d81b6e1cb346a461596d5f70",
  "js/net/segments.js": "sha256:2bff427c4f94c34ddc77734eead8b9a3ea5d6f2caced348eedd20ecb119f5460",
  "js/net/seq-tokens.js": "sha256:aa00c6ebec270b655e2973c85ac5a89db14cc3449a57d408d21603bb90ed76f3",
  "js/net/seq.js": "sha256:5d46d25b299540f8c0f453fa844eb92776b55ded7be21ed1274d8b5904f78572",
  "js/net/weights.js": "sha256:d78b24fc0e23415d7f20e72fbdea58e74d6ef05c94620ce750766557a8d62061",
  "js/views/code.js": "sha256:9ae9c5408ef85d6959c8d7ced709ca304a7a1a771f793f6bcca42f0f65a8cf37",
  "js/views/context.js": "sha256:5b1e6284d569fd82378be50883b62300f93487f1d6825e640501b965a2655808",
  "js/views/experiments.js": "sha256:b9b17aa36214e4c7f32960d8af0d68bf1bdf7393de16834ff7540ecb74b92217",
  "js/views/highlight/plain.js": "sha256:02b105906de277faf69ddf334ccd4daefa5af7240ce1a6945a700823444c4e1a",
  "js/views/highlight/python.js": "sha256:d5cc60c3da916764481b3b6ea1cc220eb0fe8c4de9113207b4374b8f49cd8290",
  "js/views/many.js": "sha256:db9243fe83ea00bce381405e726e69d277651c4c58eb6cc713e03b7efb26972d",
  "js/views/network.js": "sha256:499b1d32b5296908d577f588eaddbea3bd5aa8c90b73e60c6a0368ddd5904f94",
  "js/views/payloads.js": "sha256:35f9233bfa4e36667bc224f92c06908de318999c8cac4175d50de6d212946dc5",
  "js/views/registry.js": "sha256:81d349c7c30d02adca389098d53eb5acddb5b6c9e81ed795975a52b710350361",
  "js/views/results.js": "sha256:cc5131a4606fd71caea3a11ca1f7828a76ae069485db4d54702f0308ea0bdef0",
  "js/views/shapes/graph.js": "sha256:f0a62f36600ef8134bb6aa013add05ad0850cc65ae6daa99db67600d2b5edc80",
  "js/views/shapes/row.js": "sha256:0f05c74d5330c0bdf48d2608169fa01b1d430111295de95a46a928d6c1098577",
  "js/views/shapes/window.js": "sha256:621c60e63e0fbb4122c8e74f41b9f725722c7439e8f5aa979bd2f4e9810b42b3",
  "js/views/shared.js": "sha256:989c7c7ee7464fb41199b2234a7e5595ec64379f3b09cdf55f79eeaa296b7ca9",
  "js/views/start.js": "sha256:4f201063048a5c8fd8337b73e4595d38f25a6dbf06b48d2e50e674c512044ea8",
  "js/views/tasks/anomaly.js": "sha256:1e80e890ae7fd71df70895927793531fba6f84aefb409a75916a4954cfe0920f",